{
  "prospect": { "name": "Acme Rockets", "short": "Acme", "domain": "acmerockets.com" },
  "title": "Hog Saga: Launch Quest",
  "tagline": "Made for Acme Rockets by PostHog",
  "palette": { "primary": "#e0402a", "secondary": "#1c2a4a", "accent": "#f7c948" },
  "products": ["feature_flags", "session_replay", "error_tracking", "experiments", "product_analytics"],
  "music": { "mood": "heroic, space-age, countdown, soaring adventure", "bpm": 140 },
  "text": {
    "win": "The Scrub Monster is grounded for good. Acme's next launch lifts off on time, bug-free.",
    "lose": "Mission scrubbed. Refuel at the inn, check your telemetry and try the launch again.",
    "credits": "Made for the Acme Rockets crew by PostHog"
  },
  "game": {
    "difficulty": "hard",
    "intro": "T-minus one week. Bugs have swarmed the launch range and every countdown keeps getting scrubbed.",
    "town": { "name": "Mission Control", "inn_line": "Long countdown? Bunks are in the back, coffee is always hot." },
    "regions": [
      { "name": "Test Range", "blurb": "Green on Tuesday, red on launch day." },
      { "name": "Telemetry Woods", "blurb": "Signals everywhere, answers nowhere." },
      { "name": "Launch Pad Flats", "blurb": "Hot sand, hot engines, hotter incidents." }
    ],
    "party": [
      { "name": "Nova", "role": "Telemetry Analyst", "sprite_prompt": "a telemetry analyst with round glasses and a navy flight jacket" },
      { "name": "Rex", "role": "Flight Support", "sprite_prompt": "a flight support engineer with a headset and an orange jumpsuit" }
    ],
    "npcs": [
      { "name": "Flight Dir", "line": "Three scrubs this month. Customers keep finding the bugs before we do.", "sprite_prompt": "a flight director with a clipboard and a white shirt" },
      { "name": "Test Pilot", "line": "The test suite said green. The rocket said otherwise.", "sprite_prompt": "a test pilot in a silver flight suit with a helmet under one arm" },
      { "name": "Roadmap PM", "line": "We pick features by who shouts loudest. Numbers would be nice.", "sprite_prompt": "a product manager with a big rolled-up star chart" }
    ],
    "enemies": [
      { "name": "Flaky Test", "pain": "Passes locally, fails on the pad.", "archetype": "swarm", "sprite_prompt": "a tiny jittery grey fly with a checkmark-shaped wing" },
      { "name": "Prod Gremlin", "pain": "Found by customers before you.", "archetype": "fast", "sprite_prompt": "a small red gremlin with sparking antennae and a wrench" },
      { "name": "Opinion Moth", "pain": "Roadmap by loudest voice in the room.", "archetype": "brute", "sprite_prompt": "a big fluffy yellow moth with a megaphone mouth" },
      { "name": "Legacy Booster", "pain": "Nobody dares touch the old flight code.", "archetype": "tank", "sprite_prompt": "a rusty armoured beetle shaped like an old rocket booster" },
      { "name": "Static Storm", "pain": "Telemetry noise hides the real problem.", "archetype": "caster", "sprite_prompt": "a floating purple storm cloud crackling with radio static" }
    ],
    "boss": {
      "name": "The Scrub Monster",
      "taunt": "T-minus never! This launch is SCRUBBED!",
      "phase2": "Abort! Abort! I will scrub every launch window!",
      "sprite_prompt": "a giant navy robot shaped like a rocket fuel tank with red warning lights"
    },
    "product_lines": {
      "feature_flags": "Launch to 1% before 100%",
      "session_replay": "Rewind the telemetry, see what broke",
      "error_tracking": "Catch it before the customer calls",
      "experiments": "Settle roadmap fights with data"
    }
  }
}
